{
  "schema_version": "0.3-rc.1",
  "mncs_version": "0.3-rc.1",
  "profile_id": "measurement.diagnostic-v1",
  "baseline_id": "analyzer.epoch-one",
  "candidate_id": "analyzer.epoch-two",
  "metric": "incorrect PASS count",
  "unit": "cases",
  "direction": "minimize",
  "operational_relevance": "Incorrect PASS can conceal unsupported analysis.",
  "environment_id": "environment.example-v1",
  "hardware_id": "hardware.local-v1",
  "software_id": "software.python-v1",
  "evaluator_id": "evaluator.study-v1",
  "benchmark_id": "benchmark.recursive-study-v1",
  "warmup": "One unmeasured evaluator invocation.",
  "sample_count": 6,
  "repetitions": 3,
  "ordering": "alternating",
  "randomization": "Fixed seed 20260728 controls within-partition order.",
  "summary_statistics": ["Per-case outcomes", "Median runtime", "Maximum resident memory"],
  "uncertainty": "Small deterministic corpus; no population inference is claimed.",
  "noise_policy": "Retain all repetitions and report range.",
  "outlier_policy": "No outliers are removed.",
  "hard_constraints": ["No increase in false negatives", "No crashes or timeouts"],
  "worst_regression_limit": "Zero additional incorrect PASS outcomes.",
  "pareto_treatment": "A candidate is selected only when hard constraints hold and incorrect PASS decreases.",
  "normalization": "Counts use the same frozen evaluator categories.",
  "contamination_controls": ["Final evaluation inputs are withheld from the repair feedback process."],
  "useful_benefit_threshold": "At least one fewer incorrect PASS without a hard-constraint regression.",
  "freshness": {
    "evaluated_at": "2026-07-28T00:00:00Z",
    "valid_until": "2027-01-28T00:00:00Z",
    "policy_id": "policy.measurement-freshness-v1",
    "status": "PASS"
  },
  "reporting_mode": "all_repetitions",
  "status": "PASS",
  "limitations": ["Developer-controlled evaluation is not organizationally independent."],
  "extensions": {}
}
